[
  {
    "rank": 1,
    "market_id": 170,
    "mandi_id": "maharashtra__pimpalgaon",
    "mandi": "Pimpalgaon",
    "district_name": "Nashik",
    "as_of_date": "2025-10-30",
    "forecast_price_inr_qtl": 1439.2857,
    "lower_bound_inr_qtl": 1228.9286,
    "upper_bound_inr_qtl": 1732.1429,
    "estimated_transport_cost_inr_qtl": 143.5707,
    "expected_net_price_inr_qtl": 1295.7151,
    "uncertainty_penalty_inr_qtl": 150.9643,
    "risk_adjusted_score": 1144.7508,
    "risk_level": "high",
    "air_distance_km": 27.6097,
    "road_distance_km": 35.8927,
    "reason": "Pimpalgaon ranks #1 with forecast 1439.29, transport cost 143.57, and risk-adjusted score 1144.75 INR/quintal."
  },
  {
    "rank": 2,
    "market_id": 169,
    "mandi_id": "maharashtra__lasalgaon",
    "mandi": "Lasalgaon",
    "district_name": "Nashik",
    "as_of_date": "2025-10-30",
    "forecast_price_inr_qtl": 1275.8571,
    "lower_bound_inr_qtl": 1065.5,
    "upper_bound_inr_qtl": 1568.7143,
    "estimated_transport_cost_inr_qtl": 259.9076,
    "expected_net_price_inr_qtl": 1015.9496,
    "uncertainty_penalty_inr_qtl": 150.9643,
    "risk_adjusted_score": 864.9853,
    "risk_level": "high",
    "air_distance_km": 49.9822,
    "road_distance_km": 64.9769,
    "reason": "Lasalgaon ranks #2 with forecast 1275.86, transport cost 259.91, and risk-adjusted score 864.99 INR/quintal."
  },
  {
    "rank": 3,
    "market_id": 3108,
    "mandi_id": "maharashtra__vashi_new_mumbai",
    "mandi": "Vashi New Mumbai",
    "district_name": "Mumbai",
    "as_of_date": "2025-10-30",
    "forecast_price_inr_qtl": 1414.2857,
    "lower_bound_inr_qtl": 1203.9286,
    "upper_bound_inr_qtl": 1707.1429,
    "estimated_transport_cost_inr_qtl": 679.7085,
    "expected_net_price_inr_qtl": 734.5773,
    "uncertainty_penalty_inr_qtl": 150.9643,
    "risk_adjusted_score": 583.613,
    "risk_level": "high",
    "air_distance_km": 130.7132,
    "road_distance_km": 169.9271,
    "reason": "Vashi New Mumbai ranks #3 with forecast 1414.29, transport cost 679.71, and risk-adjusted score 583.61 INR/quintal."
  },
  {
    "rank": 4,
    "market_id": 2494,
    "mandi_id": "maharashtra__punepimpri",
    "mandi": "Pune(Pimpri)",
    "district_name": "Pune",
    "as_of_date": "2025-10-30",
    "forecast_price_inr_qtl": 1392.8571,
    "lower_bound_inr_qtl": 1182.5,
    "upper_bound_inr_qtl": 1685.7143,
    "estimated_transport_cost_inr_qtl": 800.3772,
    "expected_net_price_inr_qtl": 592.4799,
    "uncertainty_penalty_inr_qtl": 150.9643,
    "risk_adjusted_score": 441.5156,
    "risk_level": "high",
    "air_distance_km": 153.9187,
    "road_distance_km": 200.0943,
    "reason": "Pune(Pimpri) ranks #4 with forecast 1392.86, transport cost 800.38, and risk-adjusted score 441.52 INR/quintal."
  },
  {
    "rank": 5,
    "market_id": 4751,
    "mandi_id": "maharashtra__punemanjri",
    "mandi": "Pune(Manjri)",
    "district_name": "Pune",
    "as_of_date": "2025-10-30",
    "forecast_price_inr_qtl": 1142.8571,
    "lower_bound_inr_qtl": 932.5,
    "upper_bound_inr_qtl": 1435.7143,
    "estimated_transport_cost_inr_qtl": 862.5157,
    "expected_net_price_inr_qtl": 280.3414,
    "uncertainty_penalty_inr_qtl": 150.9643,
    "risk_adjusted_score": 129.3771,
    "risk_level": "high",
    "air_distance_km": 165.8684,
    "road_distance_km": 215.6289,
    "reason": "Pune(Manjri) ranks #5 with forecast 1142.86, transport cost 862.52, and risk-adjusted score 129.38 INR/quintal."
  },
  {
    "rank": 6,
    "market_id": 172,
    "mandi_id": "maharashtra__pune",
    "mandi": "Pune",
    "district_name": "Pune",
    "as_of_date": "2025-10-30",
    "forecast_price_inr_qtl": 1128.5714,
    "lower_bound_inr_qtl": 918.2143,
    "upper_bound_inr_qtl": 1421.4286,
    "estimated_transport_cost_inr_qtl": 854.4164,
    "expected_net_price_inr_qtl": 274.155,
    "uncertainty_penalty_inr_qtl": 150.9643,
    "risk_adjusted_score": 123.1907,
    "risk_level": "high",
    "air_distance_km": 164.3109,
    "road_distance_km": 213.6041,
    "reason": "Pune ranks #6 with forecast 1128.57, transport cost 854.42, and risk-adjusted score 123.19 INR/quintal."
  },
  {
    "rank": 7,
    "market_id": 4752,
    "mandi_id": "maharashtra__punemoshi",
    "mandi": "Pune(Moshi)",
    "district_name": "Pune",
    "as_of_date": "2025-10-30",
    "forecast_price_inr_qtl": 992.8571,
    "lower_bound_inr_qtl": 782.5,
    "upper_bound_inr_qtl": 1285.7143,
    "estimated_transport_cost_inr_qtl": 762.4508,
    "expected_net_price_inr_qtl": 230.4063,
    "uncertainty_penalty_inr_qtl": 150.9643,
    "risk_adjusted_score": 79.442,
    "risk_level": "high",
    "air_distance_km": 146.6252,
    "road_distance_km": 190.6127,
    "reason": "Pune(Moshi) ranks #7 with forecast 992.86, transport cost 762.45, and risk-adjusted score 79.44 INR/quintal."
  },
  {
    "rank": 8,
    "market_id": 581,
    "mandi_id": "maharashtra__chattrapati_sambhajinagar",
    "mandi": "Chattrapati Sambhajinagar",
    "district_name": "Aurangabad",
    "as_of_date": "2025-10-30",
    "forecast_price_inr_qtl": 950.0,
    "lower_bound_inr_qtl": 739.6429,
    "upper_bound_inr_qtl": 1242.8571,
    "estimated_transport_cost_inr_qtl": 834.5083,
    "expected_net_price_inr_qtl": 115.4917,
    "uncertainty_penalty_inr_qtl": 150.9643,
    "risk_adjusted_score": -35.4726,
    "risk_level": "high",
    "air_distance_km": 160.4824,
    "road_distance_km": 208.6271,
    "reason": "Chattrapati Sambhajinagar ranks #8 with forecast 950.00, transport cost 834.51, and risk-adjusted score -35.47 INR/quintal."
  },
  {
    "rank": 9,
    "market_id": 2495,
    "mandi_id": "maharashtra__punekhadiki",
    "mandi": "Pune(Khadiki)",
    "district_name": "Pune",
    "as_of_date": "2025-10-30",
    "forecast_price_inr_qtl": 842.8571,
    "lower_bound_inr_qtl": 632.5,
    "upper_bound_inr_qtl": 1135.7143,
    "estimated_transport_cost_inr_qtl": 829.5417,
    "expected_net_price_inr_qtl": 13.3154,
    "uncertainty_penalty_inr_qtl": 150.9643,
    "risk_adjusted_score": -137.6488,
    "risk_level": "high",
    "air_distance_km": 159.5272,
    "road_distance_km": 207.3854,
    "reason": "Pune(Khadiki) ranks #9 with forecast 842.86, transport cost 829.54, and risk-adjusted score -137.65 INR/quintal."
  },
  {
    "rank": 10,
    "market_id": 160,
    "mandi_id": "maharashtra__kolhapur",
    "mandi": "Kolhapur",
    "district_name": "Kolhapur",
    "as_of_date": "2025-10-30",
    "forecast_price_inr_qtl": 928.5714,
    "lower_bound_inr_qtl": 718.2143,
    "upper_bound_inr_qtl": 1221.4286,
    "estimated_transport_cost_inr_qtl": 1926.9069,
    "expected_net_price_inr_qtl": -998.3354,
    "uncertainty_penalty_inr_qtl": 150.9643,
    "risk_adjusted_score": -1149.2997,
    "risk_level": "high",
    "air_distance_km": 370.559,
    "road_distance_km": 481.7267,
    "reason": "Kolhapur ranks #10 with forecast 928.57, transport cost 1926.91, and risk-adjusted score -1149.30 INR/quintal."
  }
]
